{
  "schemaVersion": "1.0.0",
  "metadata": {
    "id": "open-riscv-soc-prototype",
    "title": "开源 RISC-V SoC 原型",
    "description": "从 ISA 契约分叉进入体系结构、RTL 验证、物理实现和软件集成；最终在可启动的 FPGA SoC 原型重新汇合",
    "language": "zh-CN",
    "generatedAt": "2026-07-30T00:00:00.000Z",
    "reviewedAt": "2026-07-30T00:00:00.000Z",
    "frameworkVersion": "0.1.0"
  },
  "domains": [
    {
      "id": "architecture",
      "title": "指令集与体系结构",
      "description": "将指令集要求转化为能够测量的微架构、存储层次和互联决策",
      "color": "#315d72",
      "order": 1
    },
    {
      "id": "rtl-verification",
      "title": "RTL 与验证",
      "description": "实现可综合硬件；通过仿真、覆盖率和形式化方法建立正确性证据",
      "color": "#4d5875",
      "order": 2
    },
    {
      "id": "physical-design",
      "title": "物理实现",
      "description": "完成综合、时序、布局、布线、功耗分析和实现签核",
      "color": "#805a46",
      "order": 3
    },
    {
      "id": "software-integration",
      "title": "软件与系统集成",
      "description": "连接工具链、固件、外设、FPGA 验证和可重复交付流程",
      "color": "#66513f",
      "order": 4
    }
  ],
  "nodes": [
    {
      "id": "architecture-isa",
      "domainId": "architecture",
      "title": "RISC-V ISA 契约",
      "outcome": "从非特权指令集读取机器级行为；确定可实现的 RV32IM 目标",
      "rationale": "只有明确指令、异常、特权假设和架构状态；RTL 才能接受一致审查",
      "dependsOn": [],
      "estimatedHours": 30,
      "resource": {
        "title": "RISC-V Ratified Specifications Library",
        "url": "https://docs.riscv.org/reference/isa/unpriv/unpriv-index.html",
        "kind": "standard",
        "publisher": "RISC-V International",
        "access": "free",
        "completeness": "whole-resource"
      },
      "acceptance": {
        "title": "ISA 实现矩阵",
        "description": "列出全部支持的指令和异常",
        "criteria": [
          "每一项绑定可执行一致性测试",
          "记录所有暂不支持的扩展"
        ]
      },
      "frontiers": [
        {
          "title": "Profile 与平台契约",
          "summary": "Profile 正在缩小可选扩展与软件兼容平台之间的距离",
          "evidence": {
            "title": "RISC-V Ratified Profiles Library",
            "url": "https://docs.riscv.org/reference/profiles-overview/index.html",
            "publishedAt": "2026-07-01",
            "sourceType": "standard"
          }
        },
        {
          "title": "向量密码扩展",
          "summary": "已经批准的向量密码扩展正在把数据无关的高吞吐密码原语带入 ISA",
          "evidence": {
            "title": "RISC-V Vector Cryptography Extensions",
            "url": "https://docs.riscv.org/reference/isa/extensions/crypto-vector/_attachments/riscv-crypto-spec-vector.pdf",
            "publishedAt": "2026-04-01",
            "sourceType": "standard"
          }
        },
        {
          "title": "能力安全架构",
          "summary": "CHERI 正在为 RISC-V 引入由硬件执行的内存能力保护",
          "evidence": {
            "title": "RISC-V CHERI Specification",
            "url": "https://riscv.github.io/riscv-cheri/",
            "publishedAt": "2025-06-01",
            "sourceType": "standard"
          }
        }
      ],
      "tags": [
        "RISC-V",
        "ISA",
        "RV32IM",
        "一致性"
      ]
    },
    {
      "id": "architecture-microarchitecture",
      "domainId": "architecture",
      "title": "流水线微架构",
      "outcome": "设计含冒险处理、旁路、控制恢复和性能测量的五级流水线",
      "rationale": "只有时序、状态转移、资源冲突和恢复行为都能够测试；框图才成为微架构",
      "dependsOn": [
        "architecture-isa"
      ],
      "estimatedHours": 48,
      "resource": {
        "title": "MIT 6.004 Computation Structures",
        "url": "https://ocw.mit.edu/courses/6-004-computation-structures-spring-2017/",
        "kind": "course",
        "publisher": "MIT OpenCourseWare",
        "access": "free",
        "completeness": "whole-resource"
      },
      "acceptance": {
        "title": "周期精确微架构规格",
        "description": "定义全部流水寄存器和控制转移",
        "criteria": [
          "提供冒险与旁路表",
          "预测至少三类工作负载的 CPI"
        ]
      },
      "frontiers": [
        {
          "title": "可配置应用级处理器",
          "summary": "CVA6 等开放处理器正在暴露更可配置的流水线和存储系统",
          "evidence": {
            "title": "CVA6 User Manual",
            "url": "https://docs.openhwgroup.org/projects/cva6-user-manual/",
            "publishedAt": "2025-06-01",
            "sourceType": "official"
          }
        },
        {
          "title": "可组合生成器生态",
          "summary": "Chipyard 正在让生成器与 SoC 配置之间的架构探索可以重复",
          "evidence": {
            "title": "Chipyard Documentation",
            "url": "https://chipyard.readthedocs.io/en/stable/",
            "publishedAt": "2025-01-15",
            "sourceType": "official"
          }
        },
        {
          "title": "Profile 驱动实现",
          "summary": "RISC-V Profile 正在影响必须共同实现的架构功能",
          "evidence": {
            "title": "RISC-V Annual Report 2025",
            "url": "https://riscv.org/wp-content/uploads/2026/01/RISC-V-Annual-Report-2025.pdf",
            "publishedAt": "2026-01-15",
            "sourceType": "official"
          }
        }
      ],
      "tags": [
        "流水线",
        "冒险",
        "旁路",
        "CPI"
      ]
    },
    {
      "id": "architecture-memory",
      "domainId": "architecture",
      "title": "存储系统架构",
      "outcome": "为小型 SoC 设计缓存、地址映射、仲裁、总线和外设连接",
      "rationale": "只有延迟、顺序、背压、地址归属和失败行为明确；CPU 才真正成为系统",
      "dependsOn": [
        "architecture-microarchitecture"
      ],
      "estimatedHours": 42,
      "resource": {
        "title": "Chipyard Documentation",
        "url": "https://chipyard.readthedocs.io/en/stable/",
        "kind": "documentation",
        "publisher": "CHIPS Alliance",
        "access": "free",
        "completeness": "whole-resource"
      },
      "acceptance": {
        "title": "可执行 SoC 地址映射",
        "description": "明确缓存与非缓存区域",
        "criteria": [
          "记录仲裁和背压规则",
          "通过 CPU 与外设并发流量测试"
        ]
      },
      "frontiers": [
        {
          "title": "面向 Chiplet 的互联",
          "summary": "SoC 组合正在从片上总线扩展到可互操作的裸片间互联",
          "evidence": {
            "title": "RISC-V Annual Report 2025",
            "url": "https://riscv.org/wp-content/uploads/2026/01/RISC-V-Annual-Report-2025.pdf",
            "publishedAt": "2026-01-15",
            "sourceType": "official"
          }
        },
        {
          "title": "一致性生成器框架",
          "summary": "Chipyard 通过可重复配置连接处理器、缓存、加速器和互联生成器",
          "evidence": {
            "title": "Chipyard Documentation",
            "url": "https://chipyard.readthedocs.io/en/stable/",
            "publishedAt": "2025-01-15",
            "sourceType": "official"
          }
        },
        {
          "title": "带能力标签的内存",
          "summary": "CHERI 引入的元数据和检查正在改变缓存与存储系统设计",
          "evidence": {
            "title": "RISC-V CHERI Specification",
            "url": "https://riscv.github.io/riscv-cheri/",
            "publishedAt": "2025-06-01",
            "sourceType": "standard"
          }
        }
      ],
      "tags": [
        "缓存",
        "互联",
        "地址映射",
        "仲裁"
      ]
    },
    {
      "id": "rtl-systemverilog",
      "domainId": "rtl-verification",
      "title": "可综合 RTL",
      "outcome": "编写参数化 SystemVerilog；明确时序边界并保持综合安全",
      "rationale": "能够仿真的代码不一定可移植、可综合、复位安全或便于时序收敛",
      "dependsOn": [],
      "estimatedHours": 36,
      "resource": {
        "title": "HDLBits",
        "url": "https://hdlbits.01xz.net/wiki/Main_Page",
        "kind": "platform",
        "publisher": "HDLBits",
        "access": "free",
        "completeness": "whole-resource"
      },
      "acceptance": {
        "title": "通过 Lint 的可复用 RTL 库",
        "description": "包含寄存器、FIFO、仲裁器和接口",
        "criteria": [
          "使用统一时钟约定和明确复位策略",
          "全部组件综合后不存在意外锁存器"
        ]
      },
      "frontiers": [
        {
          "title": "硬件编译器中间表示",
          "summary": "CIRCT 正在硬件语言和实现工具之间建立可复用编译基础设施",
          "evidence": {
            "title": "CIRCT Code Documentation",
            "url": "https://circt.llvm.org/docs/",
            "publishedAt": "2026-07-01",
            "sourceType": "official"
          }
        },
        {
          "title": "高速编译式仿真",
          "summary": "Verilator 正在把大型 SystemVerilog 设计带入接近软件编译的工作流",
          "evidence": {
            "title": "Verilator Guide",
            "url": "https://verilator.org/guide/latest/",
            "publishedAt": "2026-06-01",
            "sourceType": "official"
          }
        },
        {
          "title": "生成器驱动 RTL",
          "summary": "Chipyard 展示了超越手工复制模块的参数化硬件生成方法",
          "evidence": {
            "title": "Chipyard Documentation",
            "url": "https://chipyard.readthedocs.io/en/stable/",
            "publishedAt": "2025-01-15",
            "sourceType": "official"
          }
        }
      ],
      "tags": [
        "SystemVerilog",
        "RTL",
        "综合",
        "Lint"
      ]
    },
    {
      "id": "rtl-verification",
      "domainId": "rtl-verification",
      "title": "仿真验证",
      "outcome": "构建带断言、覆盖率和确定性回归的自检查单元与集成测试",
      "rationale": "人工查看波形无法扩展成角落情况、协议规则和恢复路径已经执行的证据",
      "dependsOn": [
        "rtl-systemverilog"
      ],
      "estimatedHours": 44,
      "resource": {
        "title": "Verilator Guide",
        "url": "https://verilator.org/guide/latest/",
        "kind": "documentation",
        "publisher": "Verilator",
        "access": "free",
        "completeness": "whole-resource"
      },
      "acceptance": {
        "title": "可重复验证回归",
        "description": "使用记分板和可执行参考模型",
        "criteria": [
          "测量功能覆盖率与结构覆盖率",
          "保存随机种子、日志和失败波形"
        ]
      },
      "frontiers": [
        {
          "title": "Python 原生验证",
          "summary": "cocotb 正在扩大协程式硬件验证和软件工具复用范围",
          "evidence": {
            "title": "cocotb Documentation",
            "url": "https://docs.cocotb.org/en/stable/",
            "publishedAt": "2025-10-01",
            "sourceType": "official"
          }
        },
        {
          "title": "大规模编译式仿真",
          "summary": "Verilator 正在为大型开放硬件系统改进语言覆盖与性能",
          "evidence": {
            "title": "Verilator Guide",